{
  "$schema": "./specs/schema/tokens.schema.json",
  "version": "0.2.0",
  "color": {
    "palette": {
      "purple": {
        "$value": "#7458FD",
        "$type": "color",
        "$description": "Raw brand purple. Use colors.brand instead."
      },
      "navy": {
        "$value": "#011638",
        "$type": "color",
        "$description": "Raw navy. Use colors.backgroundNavy instead."
      },
      "cream": {
        "$value": "#F5F1ED",
        "$type": "color",
        "$description": "Raw cream. Use colors.backgroundAlt instead."
      },
      "black": {
        "$value": "#000000",
        "$type": "color"
      },
      "offBlack": {
        "$value": "#595959",
        "$type": "color"
      },
      "greyA": {
        "$value": "#AAACB0",
        "$type": "color"
      },
      "greyB": {
        "$value": "#BABCBF",
        "$type": "color"
      },
      "greyC": {
        "$value": "#CDCED0",
        "$type": "color"
      },
      "greyD": {
        "$value": "#DDDDDF",
        "$type": "color"
      },
      "greyE": {
        "$value": "#EFF0F0",
        "$type": "color"
      },
      "greyF": {
        "$value": "#F7F7F8",
        "$type": "color"
      },
      "white": {
        "$value": "#FFFFFF",
        "$type": "color"
      },
      "green": {
        "$value": "#16C172",
        "$type": "color"
      },
      "red": {
        "$value": "#F03A47",
        "$type": "color"
      },
      "blue": {
        "$value": "#045DEC",
        "$type": "color"
      },
      "yellow": {
        "$value": "#E9D502",
        "$type": "color"
      }
    },
    "brand": {
      "$value": "#7458FD",
      "$type": "color",
      "$description": "dark: #7458FD (unchanged)"
    },
    "brandSubtle": {
      "$value": "#eceaff",
      "$type": "color",
      "$description": "dark: #2a1f6b"
    },
    "background": {
      "$value": "#FFFFFF",
      "$type": "color",
      "$description": "dark: #011638 (palette.navy)"
    },
    "backgroundElevated": {
      "$value": "#F7F7F8",
      "$type": "color",
      "$description": "dark: #0a2048"
    },
    "backgroundSunken": {
      "$value": "#F9F9FC",
      "$type": "color",
      "$description": "dark: #09193d"
    },
    "backgroundNavy": {
      "$value": "#011638",
      "$type": "color",
      "$description": "invariant - always navy"
    },
    "backgroundElevatedNavy": {
      "$value": "#0A2048",
      "$type": "color",
      "$description": "invariant - dark-mode-only elevated surface (cards/sheets/inputs raised above backgroundNavy: modals, bottom tray, search bar, floating button in dark mode). No light equivalent. Added to close a real gap found in the mobile-parity audit: this exact tone (or a near-miss of it) was already hardcoded ad hoc as '#0a2048' in at least 5 places across web and iOS, and Android had drifted to a 3rd, different hex (#0C2149) for the same concept. This token is the reconciliation point - existing call sites still reference the raw hex today and will be migrated to this token in a follow-up pass, not as part of this change."
    },
    "backgroundAlt": {
      "$value": "#F5F1ED",
      "$type": "color",
      "$description": "invariant - always cream"
    },
    "onBackground": {
      "$value": "#000000",
      "$type": "color",
      "$description": "dark: #FFFFFF"
    },
    "onBackgroundSecondary": {
      "$value": "#595959",
      "$type": "color",
      "$description": "dark: rgba(255,255,255,0.70)"
    },
    "onBackgroundTertiary": {
      "$value": "#AAACB0",
      "$type": "color",
      "$description": "dark: rgba(255,255,255,0.35)"
    },
    "outline": {
      "$value": "#CDCED0",
      "$type": "color",
      "$description": "dark: rgba(255,255,255,0.15)"
    },
    "outlineSubtle": {
      "$value": "#EFF0F0",
      "$type": "color",
      "$description": "dark: rgba(255,255,255,0.06)"
    },
    "loaderTrack": {
      "$value": "#DDDDDF",
      "$type": "color",
      "$description": "invariant"
    },
    "success": {
      "$value": "#16C172",
      "$type": "color",
      "$description": "invariant"
    },
    "successSubtle": {
      "$value": "#E8F5E9",
      "$type": "color",
      "$description": "dark: #0d3320"
    },
    "successStrong": {
      "$value": "#4CAF50",
      "$type": "color",
      "$description": "invariant"
    },
    "error": {
      "$value": "#F03A47",
      "$type": "color"
    },
    "errorSubtle": {
      "$value": "rgba(240,58,71,0.12)",
      "$type": "color"
    },
    "warning": {
      "$value": "#E9D502",
      "$type": "color"
    },
    "warningSubtle": {
      "$value": "#fefbe6",
      "$type": "color",
      "$description": "dark: #3d3400"
    },
    "info": {
      "$value": "#045DEC",
      "$type": "color"
    },
    "infoSubtle": {
      "$value": "rgba(4,93,236,0.12)",
      "$type": "color"
    },
    "vendorBrown": {
      "$value": "#6B2737",
      "$type": "color",
      "$description": "Activity feed only - do not use elsewhere"
    },
    "vendorForest": {
      "$value": "#2D5A27",
      "$type": "color",
      "$description": "Activity feed only - do not use elsewhere"
    },
    "vendorRed": {
      "$value": "#E4002B",
      "$type": "color",
      "$description": "Activity feed only - do not use elsewhere"
    },
    "vendorAmber": {
      "$value": "#F5A623",
      "$type": "color",
      "$description": "Activity feed only - do not use elsewhere"
    }
  },
  "passThemes": {
    "purple": {
      "gradientFrom": {
        "$value": "#7458FD",
        "$type": "color"
      },
      "gradientTo": {
        "$value": "#9B7FFE",
        "$type": "color"
      },
      "on": {
        "$value": "#FFFFFF",
        "$type": "color"
      }
    },
    "nhs": {
      "gradientFrom": {
        "$value": "#005EB8",
        "$type": "color"
      },
      "gradientTo": {
        "$value": "#003087",
        "$type": "color"
      },
      "on": {
        "$value": "#FFFFFF",
        "$type": "color"
      }
    },
    "university": {
      "gradientFrom": {
        "$value": "#011638",
        "$type": "color"
      },
      "gradientTo": {
        "$value": "#1A3A5C",
        "$type": "color"
      },
      "on": {
        "$value": "#FFFFFF",
        "$type": "color"
      }
    },
    "cafe": {
      "gradientFrom": {
        "$value": "#0F9B63",
        "$type": "color"
      },
      "gradientTo": {
        "$value": "#16C172",
        "$type": "color"
      },
      "on": {
        "$value": "#FFFFFF",
        "$type": "color"
      }
    },
    "guest": {
      "gradientFrom": {
        "$value": "#4A2545",
        "$type": "color"
      },
      "gradientTo": {
        "$value": "#7C3F6E",
        "$type": "color"
      },
      "on": {
        "$value": "#FFFFFF",
        "$type": "color"
      }
    }
  },
  "spacing": {
    "xs": {
      "$value": 4,
      "$type": "dimension"
    },
    "sm": {
      "$value": 8,
      "$type": "dimension"
    },
    "md": {
      "$value": 12,
      "$type": "dimension"
    },
    "lg": {
      "$value": 16,
      "$type": "dimension"
    },
    "xl": {
      "$value": 20,
      "$type": "dimension"
    },
    "2xl": {
      "$value": 24,
      "$type": "dimension"
    },
    "3xl": {
      "$value": 32,
      "$type": "dimension"
    },
    "4xl": {
      "$value": 40,
      "$type": "dimension"
    },
    "5xl": {
      "$value": 48,
      "$type": "dimension"
    }
  },
  "borderRadius": {
    "sm": {
      "$value": 6,
      "$type": "dimension"
    },
    "md": {
      "$value": 12,
      "$type": "dimension"
    },
    "lg": {
      "$value": 16,
      "$type": "dimension"
    },
    "xl": {
      "$value": 24,
      "$type": "dimension"
    },
    "full": {
      "$value": 9999,
      "$type": "dimension"
    }
  },
  "shadow": {
    "bottomA": {
      "$value": "0px 2px 2px 0px rgba(0,0,0,0.03)",
      "$type": "shadow"
    },
    "bottomB": {
      "$value": "0px 2px 2px 0px rgba(0,0,0,0.06)",
      "$type": "shadow"
    },
    "bottomC": {
      "$value": "0px 2px 10px 0px rgba(0,0,0,0.05)",
      "$type": "shadow"
    },
    "bottomD": {
      "$value": "0px 2px 15px 0px rgba(0,0,0,0.10)",
      "$type": "shadow"
    },
    "topA": {
      "$value": "0px -2px 2px 0px rgba(0,0,0,0.03)",
      "$type": "shadow"
    },
    "topB": {
      "$value": "0px -2px 2px 0px rgba(0,0,0,0.06)",
      "$type": "shadow"
    },
    "topC": {
      "$value": "0px -2px 2px 0px rgba(0,0,0,0.10)",
      "$type": "shadow"
    },
    "topD": {
      "$value": "0px -2px 15px 0px rgba(0,0,0,0.10)",
      "$type": "shadow"
    },
    "sideNav": {
      "$value": "4px 0px 15px 0px rgba(0,0,0,0.20)",
      "$type": "shadow"
    },
    "tilesActive": {
      "$value": "0px 10px 15px -3px rgba(0,0,0,0.10)",
      "$type": "shadow"
    },
    "tilesHover": {
      "$value": "0px 10px 15px -3px rgba(116,88,253,0.40)",
      "$type": "shadow"
    }
  },
  "typography": {
    "fontFamily": {
      "$value": "Poppins, sans-serif",
      "$type": "fontFamily"
    },
    "size": {
      "supporting": {
        "$value": "0.75rem",
        "$type": "dimension"
      },
      "body": {
        "$value": "0.875rem",
        "$type": "dimension"
      },
      "section": {
        "$value": "1.125rem",
        "$type": "dimension"
      },
      "title": {
        "$value": "1.375rem",
        "$type": "dimension"
      },
      "hero": {
        "$value": "2.5rem",
        "$type": "dimension"
      }
    },
    "weight": {
      "regular": {
        "$value": 400,
        "$type": "fontWeight"
      },
      "bold": {
        "$value": 700,
        "$type": "fontWeight"
      }
    }
  }
}
